{
  "applicationId": "77777777-7777-4777-8777-777777777778",
  "jobId": "22222222-2222-4222-8222-222222222222",
  "cvVersionId": "55555555-5555-4555-8555-555555555556",
  "status": "PENDING",
  "overallScore": null,
  "skillsScore": null,
  "experienceScore": null,
  "criteriaScores": {},
  "matchedSkills": [],
  "missingSkills": [],
  "breakdown": {},
  "explanation": null,
  "processingJobId": "99999999-9999-4999-8999-999999999999",
  "evaluatedAt": null,
  "message": "Fixture demo: matching is queued and waiting to be processed.",
  "retryable": true,
  "retryAfter": null,
  "attemptCount": 0,
  "maxAttempts": 3
}
